{
  "name": "trend-machine",
  "version": "0.2.1",
  "generated_at": "2026-10-12T01:45:27.018987+00:00",
  "base": "api/v1/ relative to the site root. Works on any static host; no auth, no keys, no rate limits.",
  "endpoints": {
    "trends": {
      "path": "api/v1/trends.json",
      "description": "All topics, full editorial dossiers: angles, hooks, sources[], first_seen/last_seen, stale + seeded flags. The canonical record — sort by opportunity_score desc for the hottest plays.",
      "updated": "2026-10-12T01:45:27.018987+00:00",
      "schema": "api/v1/schema/trends.json",
      "records": 341,
      "notes": "Seeded topics (seeded:true) carry researched starting-point figures in their summaries — treat as baselines, not live measurements."
    },
    "trends_flat": {
      "path": "api/v1/trends.flat.json",
      "description": "Flat consumer feed: opportunity-ranked, stale topics excluded. Lightweight 'what to make content about today' list.",
      "updated": "2026-10-12T01:45:27.018987+00:00",
      "schema": "api/v1/schema/trends-flat.json",
      "records": 341
    },
    "trends_flat_sample": {
      "path": "api/v1/trends.flat.sample.json",
      "description": "Clearly-labeled SAMPLE (sample:true) derived from seeded topics — for consumer development only, never the live path.",
      "updated": "2026-10-12T01:45:27.018987+00:00",
      "schema": "api/v1/schema/trends-flat-sample.json",
      "records": 41
    },
    "trends_flat_js": {
      "path": "api/v1/trends.flat.js",
      "description": "JSONP twin of the flat feed — trendsCallback({...}). The CORS-safe fallback for pure static hosts that cannot send Access-Control-Allow-Origin headers.",
      "updated": "2026-10-12T01:45:27.018987+00:00",
      "schema": "api/v1/schema/trends-flat.json"
    },
    "hashtags": {
      "path": "api/v1/hashtags.json",
      "description": "Tag -> topic-id index.",
      "updated": "2026-10-12T01:45:27.018987+00:00",
      "schema": "api/v1/schema/hashtags.json",
      "records": 114
    },
    "velocity": {
      "path": "api/v1/velocity.json",
      "description": "Oracle input: hourly velocity/opportunity snapshots per topic, ascending by timestamp. Classify with assets/js/trajectory.js (UMD — loadable in node) or read the precomputed api/v1/forecasts.json.",
      "updated": "2026-10-12T01:45:27.018987+00:00",
      "schema": "api/v1/schema/velocity.json",
      "records": 341,
      "notes": "Snapshots are real pipeline observations; topics with <3 snapshots get no forecast."
    },
    "platform_velocity": {
      "path": "api/v1/platform-velocity.json",
      "description": "Wave 6: per-platform hourly velocity series per topic ({topic_id: {platform: [[iso, vel], ...]}}). Starting points — series build one snapshot per refresh; trajectories classify after 3+ per-platform snapshots.",
      "updated": "2026-10-12T01:45:27.018987+00:00",
      "schema": "api/v1/schema/platform-velocity.json",
      "records": 302,
      "notes": "Empty/missing series mean 'still building history', never a guess."
    },
    "schemas": {
      "path": "api/v1/schema/",
      "description": "JSON Schema (draft-07) for every endpoint.",
      "updated": "2026-10-12T01:45:27.018987+00:00",
      "records": 10
    },
    "forecasts": {
      "path": "api/v1/forecasts.json",
      "description": "Oracle output: precomputed trajectory classifications (peaking_48h / rising_fast / cooling_off / steady) from the same classifier as the dashboard. Every forecast is a projection from N snapshots — never a guarantee. Wave 6 adds confidence basis, signal attribution, and per-platform trajectories.",
      "schema": "api/v1/schema/forecasts.json",
      "updated": "2026-10-12T01:45:28.760Z",
      "records": 341,
      "notes": "Topics with fewer than 3 snapshots are excluded from the lists (counts.insufficient). Additive-only changes; no payload-shape breaks."
    },
    "forecast_accuracy": {
      "path": "api/v1/forecast-accuracy.json",
      "description": "The Oracle's own scorecard: forecast-vs-actual ledger (hit/miss per forecast after a 48h horizon). Hit rate shown only after 10+ forecasts resolve; before that the status is 'building history'.",
      "schema": "api/v1/schema/forecast-accuracy.json",
      "updated": "2026-10-12T01:45:28.760Z",
      "records": 143,
      "notes": "Started 2026-10-11 — first resolutions land 48h later. Nothing backfilled."
    }
  },
  "deprecated": [],
  "changelog": "0.2.1 (2026-10-11): Oracle 2.0 — forecasts.json records now carry confidence basis (snapshot count + fit quality), signal attribution (velocity delta, slope, accel, recency, cross-platform spread, fired thresholds), and per-platform trajectories (additive only, no shape changes). New api/v1/platform-velocity.json and api/v1/forecast-accuracy.json (the Oracle's own forecast-vs-actual log; 'building history' until 10+ forecasts resolve). 0.2.0 (2026-10-11): index.json endpoints are now objects {path, description, schema, updated, records, notes} (was plain path strings). Added flat-feed, JSONP, velocity entries; draft-07 schemas for every endpoint under api/v1/schema/. api/v1/forecasts.json is added by the post-build forecast step (scripts/build_forecasts.js) when present.",
  "usage": "GET api/v1/trends.json, sort by opportunity_score desc for the hottest plays. Start at api/v1/index.json for the full endpoint map."
}